{
  "type": "decouverte",
  "version": 1,
  "img": "",
  "audioFile": null,
  "chant": null,
  "pedagogie": {
    "ages": [
      9,
      99
    ],
    "duree_min": 8,
    "objectif": "Identifier le rôle décisif des défenseurs et s'entraîner à occuper ce rôle sans s'exposer",
    "programme": [
      "cycle 3",
      "cycle 4"
    ]
  },
  "id": "defenseur",
  "nom": "Les défenseurs",
  "latin": "Défenseur · Salmivalli, 1996",
  "emoji": "🛡️",
  "couleur": "#0f9b8e",
  "categorie": "diurne",
  "taille": "Réflexe : soutenir, alerter, ne pas relayer",
  "anecdotes": [
    "La psychologue Salmivalli a montré que le harcèlement est un phénomène de groupe : harceleurs, témoins, défenseurs… chacun a un rôle.",
    "Il y a presque toujours plus de témoins que de harceleurs : leur attitude décide si la situation continue ou s'arrête.",
    "Être défenseur ne veut pas dire se battre : soutenir la personne, partir chercher un adulte, refuser de relayer."
  ],
  "quiz": [
    {
      "q": "Être un défenseur, c'est surtout…",
      "options": [
        "Soutenir la victime et alerter",
        "Se battre avec le harceleur",
        "Ignorer complètement"
      ],
      "reponse": 0
    },
    {
      "q": "Dans une classe où les élèves réagissent, le harcèlement…",
      "options": [
        "Recule fortement",
        "Double",
        "Ne change jamais"
      ],
      "reponse": 0
    }
  ]
}
