{
    "type":  "decouverte",
    "version":  1,
    "id":  "curios",
    "nom":  "Curi\u003es, le jeu",
    "latin":  "Exploration Â· DÃ©couverte",
    "emoji":  "ðŸ§­",
    "couleur":  "#e67e22",
    "categorie":  "diurne",
    "taille":  "Astuce : explore chaque balise avant de valider",
    "img":  "",
    "audioFile":  null,
    "anecdotes": [
        "Le Professeur Curi🧭s a créé la Machine à Comprendre la France : ses fragments sont dispersés à travers la France et les territoires ultramarins.",
        "Prologue : « Bonjour, jeune explorateur. Si tu entends ce message, c’est que la situation est… légèrement catastrophique. »",
        "Mission : retrouver les fragments en observant, mesurant et expérimentant avec ton smartphone."
    ],
    "chant":  {
                  "tempo":  100,
                  "notes":  [
                                {
                                    "f":  262,
                                    "fEnd":  262,
                                    "d":  0.12,
                                    "g":  0.07,
                                    "type":  "sine",
                                    "v":  0.5
                                },
                                {
                                    "f":  392,
                                    "fEnd":  392,
                                    "d":  0.12,
                                    "g":  0.07,
                                    "type":  "sine",
                                    "v":  0.5
                                },
                                {
                                    "f":  523,
                                    "fEnd":  523,
                                    "d":  0.1,
                                    "g":  0.15,
                                    "type":  "sine",
                                    "v":  0.4
                                }
                            ]
              },
    "pedagogie":  {
                      "ages":  [
                                   8,
                                   18
                               ],
                      "duree_min":  10,
                      "objectif":  "DÃ©couvrir le fonctionnement global du jeu et ses mÃ©caniques de balise",
                      "programme":  [
                                        "cycle 3",
                                        "cycle 4"
                                    ]
                  },
    "quiz":  [
                 {
                     "q":  "Curi\u003es est avant tout un jeu deâ€¦",
                     "options":  [
                                     "CompÃ©tition individuelle",
                                     "DÃ©couverte et coopÃ©ration",
                                     "Course contre la montre",
                                     "Puzzle"
                                 ],
                     "reponse":  1
                 },
                 {
                     "q":  "Le jeu peut-il jouer sans connexion internet ?",
                     "options":  [
                                     "Non, jamais",
                                     "Oui, hors-ligne",
                                     "Seulement le week-end",
                                     "Uniquement avec un abonnement"
                                 ],
                     "reponse":  1
                 }
             ]
}